{
  "$schema": "https://aos-data.org/schema/battle-formation.schema.json",
  "id": "stomper-tribe",
  "name": "Stomper Tribe",
  "faction": "sons-of-behemat",
  "abilities": [
    {
      "name": "Revel in War",
      "type": "passive",
      "effect": "You can pick 2 friendly **^^Mega‑Gargants^^** or **^^Gargant^^** units that have not used a **^^Rampage^^** ability this turn to use the ‘Jump Up and Down’ ability instead of 1.",
      "color": "Red",
      "abilityCategory": "Offensive"
    }
  ],
  "_meta": {
    "lastUpdated": "2026-01-06",
    "source": "BSData import"
  }
}
