{
  "$schema": "https://aos-data.org/schema/battle-formation.schema.json",
  "id": "outcasts",
  "name": "Outcasts",
  "faction": "sylvaneth",
  "abilities": [
    {
      "name": "The Terror in the Eaves",
      "type": "passive",
      "effect": "Subtract 3 from the control scores of enemy units while they are in combat with friendly **^^Sylvaneth^^** units.",
      "color": "Purple",
      "abilityCategory": "Control"
    }
  ],
  "_meta": {
    "lastUpdated": "2026-01-08",
    "source": "BSData import"
  }
}
