{
  "$schema": "https://aos-data.org/schema/battle-formation.schema.json",
  "id": "ironjawz-brawl",
  "name": "Ironjawz Brawl",
  "faction": "ironjawz",
  "abilities": [
    {
      "name": "Natural Disaster",
      "type": "passive",
      "effect": "If you make an unmodified charge roll of 8+ for a friendly non-**^^Hero Ironjawz^^** unit, add 1 to the Attacks characteristic of that unit’s melee weapons for the rest of the turn.",
      "color": "Orange",
      "abilityCategory": "Offensive"
    }
  ],
  "_meta": {
    "lastUpdated": "2026-01-08",
    "source": "BSData import"
  }
}
