{
  "$schema": "https://aos-data.org/schema/battle-formation.schema.json",
  "id": "forge-brethren",
  "name": "Forge Brethren",
  "faction": "fyreslayers",
  "abilities": [
    {
      "name": "Bulwark of Molten Stone",
      "type": "passive",
      "effect": "Add 1 to save rolls for friendly **^^Fyreslayers Infantry^^** units while they are wholly within friendly territory.",
      "color": "Green",
      "abilityCategory": "Defensive"
    }
  ],
  "_meta": {
    "lastUpdated": "2026-01-06",
    "source": "BSData import"
  }
}
