{
  "$schema": "https://aos-data.org/schema/battle-formation.schema.json",
  "id": "troggherd",
  "name": "Troggherd",
  "faction": "gloomspite-gitz",
  "abilities": [
    {
      "name": "Herd Healing",
      "type": "passive",
      "effect": "Each time a friendly **^^Troggoth^^** unit uses a **^^Fight^^** ability, after that ability has been resolved, **Heal (D3)** that unit.",
      "color": "Green",
      "abilityCategory": "Defensive"
    }
  ],
  "_meta": {
    "lastUpdated": "2026-01-06",
    "source": "BSData import"
  }
}
